{
  "workspace_format_version": "0.2.0",
  "project": {
    "project_version": "0.2.0",
    "id": "illustrative-3d-workspace",
    "domain": {
      "geometry": "volume",
      "counts_xyz": [
        18,
        12,
        6
      ],
      "spacing_um_xyz": [
        2,
        2,
        2
      ]
    },
    "groups": {
      "group_1": {
        "ids": [
          "cell_0",
          "cell_1",
          "cell_2",
          "cell_3",
          "cell_4",
          "cell_5",
          "cell_6",
          "cell_7"
        ],
        "positions_um": [
          [
            6,
            6,
            3
          ],
          [
            12,
            7,
            5
          ],
          [
            19,
            5,
            8
          ],
          [
            27,
            7,
            3
          ],
          [
            7,
            17,
            9
          ],
          [
            14,
            18,
            3
          ],
          [
            22,
            16,
            7
          ],
          [
            29,
            18,
            9
          ]
        ],
        "orientation_xyzw": [
          [
            0,
            0,
            0.0,
            1.0
          ],
          [
            0,
            0,
            0.20845989984609956,
            0.9780309147241483
          ],
          [
            0,
            0,
            -0.34289780745545134,
            0.9393727128473789
          ],
          [
            0,
            0,
            0.5226872289306592,
            0.8525245220595057
          ],
          [
            0,
            0,
            -0.14943813247359922,
            0.9887710779360422
          ],
          [
            0,
            0,
            0.3894183423086505,
            0.9210609940028851
          ],
          [
            0,
            0,
            -0.5646424733950354,
            0.8253356149096783
          ],
          [
            0,
            0,
            0.09983341664682815,
            0.9950041652780258
          ]
        ],
        "initial_geometry": [
          {
            "shape": "capsule",
            "length_um": 3.0,
            "diameter_um": 1.2,
            "provenance": {
              "kind": "example",
              "reference": "illustrative starting size"
            }
          },
          {
            "shape": "capsule",
            "length_um": 3.0,
            "diameter_um": 1.2,
            "provenance": {
              "kind": "example",
              "reference": "illustrative starting size"
            }
          },
          {
            "shape": "capsule",
            "length_um": 3.0,
            "diameter_um": 1.2,
            "provenance": {
              "kind": "example",
              "reference": "illustrative starting size"
            }
          },
          {
            "shape": "capsule",
            "length_um": 3.0,
            "diameter_um": 1.2,
            "provenance": {
              "kind": "example",
              "reference": "illustrative starting size"
            }
          },
          {
            "shape": "capsule",
            "length_um": 3.0,
            "diameter_um": 1.2,
            "provenance": {
              "kind": "example",
              "reference": "illustrative starting size"
            }
          },
          {
            "shape": "capsule",
            "length_um": 3.0,
            "diameter_um": 1.2,
            "provenance": {
              "kind": "example",
              "reference": "illustrative starting size"
            }
          },
          {
            "shape": "capsule",
            "length_um": 3.0,
            "diameter_um": 1.2,
            "provenance": {
              "kind": "example",
              "reference": "illustrative starting size"
            }
          },
          {
            "shape": "capsule",
            "length_um": 3.0,
            "diameter_um": 1.2,
            "provenance": {
              "kind": "example",
              "reference": "illustrative starting size"
            }
          }
        ]
      }
    },
    "species": {
      "oxygen": {
        "concentration_unit": "uM",
        "initial_concentration": {
          "value": 5,
          "unit": "uM",
          "provenance": {
            "kind": "example",
            "reference": "registered only; no oxygen module is active"
          }
        }
      }
    },
    "controls": {},
    "graph": {
      "protocol_version": "0.1.0",
      "id": "illustrative-3d-workspace-graph",
      "nodes": [
        {
          "id": "elongation",
          "module_id": "growth.linear_elongation",
          "module_version": "1.0.0",
          "owner": {
            "kind": "population",
            "id": "group_1"
          },
          "parameters": {
            "elongation_rate": {
              "value": 0.5,
              "unit": "um/s",
              "provenance": {
                "kind": "example",
                "reference": "illustrative, without nutrient coupling"
              }
            }
          }
        },
        {
          "id": "adder",
          "module_id": "division.length_adder",
          "module_version": "1.0.0",
          "owner": {
            "kind": "population",
            "id": "group_1"
          },
          "parameters": {
            "added_length_um": {
              "value": 1.0,
              "unit": "um",
              "provenance": {
                "kind": "example",
                "reference": "illustrative adder increment, not a measured strain"
              }
            }
          }
        }
      ],
      "edges": [
        {
          "id": "growth_to_adder",
          "from": {
            "node": "elongation",
            "port": "length"
          },
          "to": {
            "node": "adder",
            "port": "length"
          },
          "timing": "same_step"
        }
      ]
    },
    "run": {
      "protocol_version": "0.1.0",
      "run_id": "illustrative-3d-workspace-run",
      "graph_id": "illustrative-3d-workspace-graph",
      "groups": [
        "group_1"
      ],
      "channels": {
        "adder.added_length": {
          "node": "adder",
          "port": "added_length",
          "group_id": "group_1",
          "shape": "cell.scalar",
          "quantity": "added_length",
          "unit": "um"
        }
      }
    }
  },
  "population_blocks": [
    {
      "id": "group_1",
      "name": "group_1",
      "center": [
        17.5,
        11.5,
        6
      ],
      "size": [
        26,
        16,
        9
      ],
      "rotation": [
        0,
        0,
        0
      ],
      "count": 8,
      "length": 3,
      "diameter": 1.2,
      "seed": 4198766536,
      "dirty": false,
      "hidden": false,
      "locked": false
    }
  ],
  "graph_layout": {
    "elongation": {
      "x": 70,
      "y": 70
    },
    "adder": {
      "x": 350,
      "y": 70
    }
  },
  "run_settings": {
    "dt_s": 0.5,
    "steps": 8
  }
}
